availableSeats,capacity,code,credit,department,levels,title,waitlistAvailable,webEnabled
98,1725,GE1401,3,English,B,University English,N,true
20,125,GE2401,3,English,B,English for Science,N,true
171,450,GE2402,3,English,B,English for Business Communication,N,true
0,125,GE2404,3,English,B,Asian Literature in English,N,true
2,75,GE2405,3,English,B,Creative Writing,N,true
1,75,GE2407,3,English,B,"Reading Lives, Writing Selves: Autobiography and Culture",N,true
42,150,GE2408,3,English,B,Travel Writing: Discovery and Experience,N,true
58,100,GE2409,3,English,B,Words and Images: Reading and Writing in the 21st Century,N,true
84,350,GE2410,3,English,B,English for Engineering,N,true
73,250,GE3401,3,English,B,Exploring English Cinema,N,true
3,950,GE1501,3,Chinese and History,"A,B",Chinese Civilisation - History and Philosophy,Y,true
16,50,GE1101,3,Chinese and History,"A,B",Chinese Cultural Heritage in Modern Perspective,Y,true
24,121,GE1104,3,Chinese and History,"A,B",Chinese Cultural Canons and Their Modern Application,Y,true
7,75,GE1107,3,Chinese and History,"A,B",The City in Chinese History and Culture,Y,true
0,180,GE1110,3,School of Creative Media,"A,B",Exploring Contemporary Art,Y,true
31,100,GE1112,3,Chinese and History,"A,B",Chán Culture and Contemporary Society,Y,true
0,95,GE1113,3,School of Creative Media,"A,B",Visual Storytelling and Cultural Thinking,Y,true
0,50,GE1114,3,Chinese and History,"A,B",Women's Lives in Chinese History,Y,true
0,45,GE1117,3,Public Policy,B,Music and Human Values: Philosophical Investigations,FULL,true
7,55,GE1127,3,School of Creative Media,"A,B",Money and Art: Exchange and Transaction As Themes in Art-works,Y,true
0,60,GE1128,3,School of Creative Media,"A,B",Music for Film,Y,true
0,80,GE1129,3,School of Creative Media,"A,B",Creative Photography,FULL,true
0,87,GE1130,3,School of Creative Media,B,Introduction to Digital Media,FULL,true
8,80,GE1132,3,Linguistics and Translation,B,"Mind, Brain and Language: How Are Human Beings Special?",Y,true
0,20,GE1134,3,Applied Social Sciences,B,Movies and Psychology,FULL,true
0,135,GE2101,3,Public Policy,B,Rational Thinking and Creative Ideas,FULL,true
48,60,GE2103,3,Chinese and History,"A,B",Appreciating Masterpieces of Western Culture,Y,true
0,59,GE2105,3,English,"A,B",Popular Culture,FULL,true
0,45,GE2106,3,Public Policy,B,Philosophy and Life: A Dialogue,FULL,true
0,60,GE2108,3,English,"A,B",Literature in Our Lives,Y,true
0,120,GE2109,3,Applied Social Sciences,B,"Love, Sex, and Relationships: Psychological Perspectives",FULL,true
0,180,GE2112,3,Asian & International Studies,"A,B","Vampires, Monsters and Teen Demons: A Study of the Gothic in Literature and Culture",Y,true
0,180,GE2117,3,Asian & International Studies,B,"Eat, Drink, Man, Woman: Cultural Identity of Koreans",Y,true
111,180,GE2120,3,Asian & International Studies,B,Asian Values and Managerial Practices,Y,true
55,123,GE2122,3,Linguistics and Translation,"A,B","The Cantonese Language in Use: Language, Grammar and Culture",Y,true
20,120,GE2125,3,Linguistics and Translation,B,"The Bible: Its History, Literature, and Influence",Y,true
0,90,GE2127,3,Architecture and Civil Engg,B,"Computer-Aided Visual Design & Electronic Arts - Programing with Image,Audio,Animation & Interaction",FULL,true
0,420,GE2129,3,Applied Social Sciences,B,Psychology for Young Professionals,Y,true
0,30,GE3106,3,School of Creative Media,"A,B",Documentary and Everyday Urban Life,FULL,true
0,60,GE4102,3,School of Creative Media,B,"Video Game: History, Industry, Society, and Creativity",FULL,true
0,80,GE1201,3,Information Systems,"A,B",Information Management and Its Social Impact,Y,true
84,240,GE1202,3,Economics & Finance,B,Managing Your Personal Finance,Y,true
132,270,GE1204,3,Accountancy,"A,B",Living with the Unexpected and Unknown in Modern Society,Y,true
0,155,GE1205,3,Economics & Finance,B,Green Economics,Y,true
0,240,GE1206,3,Information Systems,"A,B",Accelerating Professional Growth on the Web,Y,true
0,40,GE1207,3,Marketing,"A,B",Organizational and Personal Image Management,FULL,true
0,66,GE1212,3,Information Systems,B,Building Personal and Firm Images in the Digital Society,FULL,true
13,80,GE1218,3,Public Policy,B,Make a Difference: The Challenge of Social Entrepreneurship in a Globalized World,Y,true
39,180,GE1222,3,Accountancy,B,Accounting in Everyday Life,Y,true
0,120,GE1223,3,Media and Communication,"A,B",Public Health Communication,FULL,true
64,120,GE1224,3,Media and Communication,B,Graffiti as Graphic and Global Communication,Y,true
0,160,GE1225,3,Marketing,B,Become a Smart and Responsible Consumer,Y,true
0,10,GE1226,3,Applied Social Sciences,B,Youth in a Changing Society,FULL,true
35,80,GE2202,3,Management Sciences,B,Globalization and Business,Y,true
53,80,GE2204,3,Management,"A,B",Business Ethics and Society,Y,true
153,180,GE2205,3,Asian & International Studies,B,Lifestyle Diversity and Choices,Y,true
46,160,GE2209,3,Marketing,B,Market Developments in China,Y,true
73,100,GE2210,3,Public Policy,"A,B",China: A Socio-Political Transformation,Y,true
0,80,GE2211,3,Applied Social Sciences,B,"Sexuality, Culture and Diversity",FULL,true
49,80,GE2212,3,Management,"A,B",Contemporary Business Communication,Y,true
160,240,GE2213,3,Management Sciences,"A,B",Understanding Uncertainty and Statistical Reasoning,Y,true
35,60,GE2216,3,English,"A,B",New Literacies in the Information Age,Y,true
0,55,GE2218,3,Applied Social Sciences,B,Career Excellence in the 21st Century,Y,true
0,80,GE2220,3,Marketing,B,Sustainable Business: Doing Good Business While Doing Good,Y,true
0,240,GE2221,3,Applied Social Sciences,B,Violence and Crime,Y,true
0,40,GE2223,3,Applied Social Sciences,B,Interpersonal Skills and Positive Personal Development,FULL,true
0,120,GE2225,3,Media and Communication,B,Media and Consumption: Food and Fashion in Everyday Life,Y,true
42,95,GE2226,3,Applied Social Sciences,B,Ageing Society: Hong Kong and Beyond,Y,true
0,80,GE2229,3,Economics & Finance,B,Uncovering the Global Economy through News,Y,true
0,75,GE2231,3,Management,"A,B","Business, Media and Society",Y,true
96,160,GE2242,3,Information Systems,B,Conducting Online Commerce in China,Y,true
16,80,GE2246,3,Public Policy,B,Changing Our Society: Turning Social Problems into Business Opportunities,Y,true
59,80,GE2249,3,Management,B,Maximising the Study Abroad Experience,Y,true
71,98,GE2250,3,Architecture and Civil Engg,B,Understand Global Projects for Business and Engineering Professionals,Y,true
60,90,GE2251,3,Architecture and Civil Engg,B,"Survey in Daily Life: Engineering, Business, and Political Applications",Y,true
68,91,GE2253,3,Architecture and Civil Engg,B,Real Estate Development: Principles and Process,Y,true
59,80,GE2254,3,Management,"A,B",Competition and Cooperation in Diverse Contexts,Y,true
80,120,GE3201,3,Media and Communication,B,China in the Eyes of World Media,Y,true
11,80,GE3204,3,Management,B,Business and Hong Kong Society,Y,true
0,60,GE1301,3,Sch of Energy and Environment,"A,B",Climate Change and Extreme Weather,FULL,true
0,105,GE1305,3,Physics & Materials Science,"A,B",Everyday Physics: Its Impact on You and Society,Y,true
0,65,GE1310,3,Biology & Chemistry,"A,B",The Biochemistry of Attraction,Y,true
117,195,GE1322,3,Electronic Engineering,B,"Brain Machine Interface: Technology, Culture, and Society",Y,true
23,45,GE1325,3,Mechanical and Biomedical Engg,B,From Ideas to Innovative Design,Y,true
0,140,GE1326,3,Systems Engg and Engg Mgt,B,Common Accidents in Modern Day City Life - Inevitable? Preventable?,FULL,true
71,102,GE1327,3,Mathematics,B,Navigating Risk,Y,true
0,55,GE1328,3,Biomedical Sciences,B,"Mind, Body and Energy",Y,true
0,97,GE1330,3,Mechanical and Biomedical Engg,B,Learning from Nature,Y,true
28,105,GE1331,3,Electronic Engineering,B,Problem Solving Made Easy,Y,true
10,94,GE1332,3,Architecture and Civil Engg,B,Beauty of Ancient Chinese Architecture,Y,true
69,97,GE1334,3,Mechanical and Biomedical Engg,B,New Materials in the 21st Century,Y,true
0,40,GE1337,3,Sch of Energy and Environment,B,Urban Green City: Pollution and Solution,FULL,true
0,95,GE1343,3,Architecture and Civil Engg,B,Energy Crisis and Renewable Energy,FULL,true
32,97,GE1344,3,Mechanical and Biomedical Engg,B,Nutrition and Wellness,Y,true
0,80,GE1346,3,Biology & Chemistry,B,The Chemists Kitchen (The Science of Food and Cooking),Y,true
22,62,GE1347,3,Electronic Engineering,B,Technology and the Land Trekking Adventurer,Y,true
0,54,GE2301,3,Mechanical and Biomedical Engg,"A,B",Science and Technology: From Past to Future,Y,true
0,60,GE2302,3,Biology & Chemistry,B,Forensics and Modern Society,Y,true
43,91,GE2303,3,Architecture and Civil Engg,"A,B",Save the Earth: Sustainable Development,Y,true
39,50,GE2304,3,Systems Engg and Engg Mgt,B,Innovation and Entrepreneurship for Young Professionals,Y,true
0,205,GE2305,3,Physics & Materials Science,"A,B",Astronomy - The Sky and Us,FULL,true
0,230,GE2314,3,Building Science & Technology,"A,B",Construction As One of the Founding Stones of Modern Hong Kong,FULL,true
0,150,GE2315,3,Computer Science,"A,B",Security and Privacy in the Information Age,Y,true
0,220,GE2316,3,Electronic Engineering,B,"Computing Snapshot, Today and Tomorrow",Y,true
136,190,GE2318,3,Electronic Engineering,B,From Ancient Wisdom to Modern Science,Y,true
29,48,GE2319,3,Systems Engg and Engg Mgt,B,Industrial Engineering and Management of Modern Enterprises,Y,true
55,70,GE2320,3,Mechanical and Biomedical Engg,B,Robots in Our Life: How Applications of Robots Affect Our Life and Society,Y,true
91,120,GE2322,3,Biology & Chemistry,B,The Nobel Spirit,Y,true
2,150,GE2323,3,Computer Science,"A,B","Mobile Social Networks: Practices, Challenges, and Beyond",Y,true
22,60,GE2324,3,Computer Science,"A,B",The Art and Science of Data,Y,true
10,60,GE2326,3,Computer Science,"A,B",Probability in Action: From the Unfinished Game to the Modern World,Y,true
54,90,GE2328,3,Systems Engg and Engg Mgt,B,Understanding and Improving Enterprises for Future Leaders,Y,true
0,110,GE2329,3,Building Science & Technology,"A,B",Green Buildings: Discovery and Innovations,FULL,true